{
  "scenario_id": "pack-40218962a6",
  "provenance": "FICTIONAL production challenge: sponsor-selected v5 representative-import electricity; historical-derived synthetic actuals, smooth uncertain forecasts, one-hop imports (not recursive flow tracing). Existing 15 workloads, datacenter PUE, quotas and fictional France overlay retained from archived challenge pack; workload v5 sets CPU work to 14600 total vCPU-hours for scheduling slack (w-01 stays at 1000); GPU work and other workload parameters are unchanged.; owner-supplied averaged non-usage LCA rates, explicitly estimated effective IT power, time-varying electricity and challenge PUE applied once",
  "zones": [
    {
      "name": "Vienna 1",
      "location": {
        "city": "Vienna",
        "latitude": 48.21,
        "longitude": 16.37,
        "precision": "city"
      },
      "pue_provenance": "fictional_game_value",
      "slug": "at-vie-1",
      "country": "AT",
      "electricity_area": "AT",
      "eu_member": true,
      "pue": "1.28",
      "fictional": false
    },
    {
      "name": "Vienna 2",
      "location": {
        "city": "Vienna",
        "latitude": 48.21,
        "longitude": 16.37,
        "precision": "city"
      },
      "pue_provenance": "fictional_game_value",
      "slug": "at-vie-2",
      "country": "AT",
      "electricity_area": "AT",
      "eu_member": true,
      "pue": "1.23",
      "fictional": false
    },
    {
      "name": "Sofia",
      "location": {
        "city": "Sofia",
        "latitude": 42.7,
        "longitude": 23.32,
        "precision": "city"
      },
      "pue_provenance": "fictional_game_value",
      "slug": "bg-sof-1",
      "country": "BG",
      "electricity_area": "BG",
      "eu_member": true,
      "pue": "1.47",
      "fictional": false
    },
    {
      "name": "Zurich",
      "location": {
        "city": "Zurich",
        "latitude": 47.38,
        "longitude": 8.54,
        "precision": "city"
      },
      "pue_provenance": "fictional_game_value",
      "slug": "ch-dk-2",
      "country": "CH",
      "electricity_area": "CH",
      "eu_member": false,
      "pue": "1.29",
      "fictional": false
    },
    {
      "name": "Geneva",
      "location": {
        "city": "Geneva",
        "latitude": 46.2,
        "longitude": 6.14,
        "precision": "city"
      },
      "pue_provenance": "fictional_game_value",
      "slug": "ch-gva-2",
      "country": "CH",
      "electricity_area": "CH",
      "eu_member": false,
      "pue": "1.35",
      "fictional": false
    },
    {
      "name": "Frankfurt",
      "location": {
        "city": "Frankfurt",
        "latitude": 50.11,
        "longitude": 8.68,
        "precision": "city"
      },
      "pue_provenance": "fictional_game_value",
      "slug": "de-fra-1",
      "country": "DE",
      "electricity_area": "DE",
      "eu_member": true,
      "pue": "1.20",
      "fictional": false
    },
    {
      "name": "Munich",
      "location": {
        "city": "Munich",
        "latitude": 48.14,
        "longitude": 11.58,
        "precision": "city"
      },
      "pue_provenance": "fictional_game_value",
      "slug": "de-muc-1",
      "country": "DE",
      "electricity_area": "DE",
      "eu_member": true,
      "pue": "1.40",
      "fictional": false
    },
    {
      "name": "Zagreb",
      "location": {
        "city": "Zagreb",
        "latitude": 45.81,
        "longitude": 15.98,
        "precision": "city"
      },
      "pue_provenance": "fictional_game_value",
      "slug": "hr-zag-1",
      "country": "HR",
      "electricity_area": "HR",
      "eu_member": true,
      "pue": "1.38",
      "fictional": false
    },
    {
      "name": "Madrid",
      "location": {
        "city": "Madrid",
        "latitude": 40.42,
        "longitude": -3.7,
        "precision": "city"
      },
      "pue_provenance": "fictional_game_value",
      "slug": "es-mad-1",
      "country": "ES",
      "electricity_area": "ES",
      "eu_member": true,
      "pue": "1.40",
      "fictional": true
    },
    {
      "name": "Milan",
      "location": {
        "city": "Milan",
        "latitude": 45.46,
        "longitude": 9.19,
        "precision": "city"
      },
      "pue_provenance": "fictional_game_value",
      "slug": "it-mil-1",
      "country": "IT",
      "electricity_area": "IT",
      "eu_member": true,
      "pue": "1.22",
      "fictional": true
    },
    {
      "name": "Paris",
      "location": {
        "city": "Paris",
        "latitude": 48.86,
        "longitude": 2.35,
        "precision": "city"
      },
      "pue_provenance": "fictional_game_value",
      "slug": "fr-par-1",
      "country": "FR",
      "electricity_area": "FR",
      "eu_member": true,
      "pue": "1.52",
      "fictional": true
    }
  ],
  "profiles": [
    {
      "power_basis": "it_before_pue",
      "lifecycle_kg_per_hour": "0.005851375000",
      "lifecycle_source": "exoscale-lca-estimates-v1:cpu.extra-large",
      "power_provenance": "estimated_effective_it_before_pue:relative_usage_proxy_v1",
      "specification_provenance": "Source-matched hardware; game throughput and memory units; power estimated from LCA usage proxy (see power_provenance).",
      "id": "20000000-0000-4000-8000-000000000001",
      "family": "cpu",
      "size": "extra-large",
      "cpu_cores": 8,
      "gpu_count": 0,
      "memory_gib": 16,
      "active_watts": "24.679444",
      "idle_watts": "4.935889",
      "stopped_watts": "0",
      "throughput": "8",
      "work_unit": "vcpu_hour",
      "boot_seconds": 120,
      "zones": [
        "at-vie-1",
        "at-vie-2",
        "bg-sof-1",
        "ch-dk-2",
        "ch-gva-2",
        "de-fra-1",
        "de-muc-1",
        "hr-zag-1",
        "es-mad-1",
        "it-mil-1",
        "fr-par-1"
      ]
    },
    {
      "power_basis": "it_before_pue",
      "lifecycle_kg_per_hour": "0.007921000000",
      "lifecycle_source": "exoscale-lca-estimates-v1:cpu.huge",
      "power_provenance": "estimated_effective_it_before_pue:relative_usage_proxy_v1",
      "specification_provenance": "Source-matched hardware; game throughput and memory units; power estimated from LCA usage proxy (see power_provenance).",
      "id": "20000000-0000-4000-8000-000000000002",
      "family": "cpu",
      "size": "huge",
      "cpu_cores": 16,
      "gpu_count": 0,
      "memory_gib": 32,
      "active_watts": "47.345184",
      "idle_watts": "9.469037",
      "stopped_watts": "0",
      "throughput": "16",
      "work_unit": "vcpu_hour",
      "boot_seconds": 120,
      "zones": [
        "at-vie-1",
        "at-vie-2",
        "bg-sof-1",
        "ch-dk-2",
        "ch-gva-2",
        "de-fra-1",
        "de-muc-1",
        "hr-zag-1",
        "es-mad-1",
        "it-mil-1",
        "fr-par-1"
      ]
    },
    {
      "power_basis": "it_before_pue",
      "lifecycle_kg_per_hour": "0.012060750000",
      "lifecycle_source": "exoscale-lca-estimates-v1:cpu.mega",
      "power_provenance": "estimated_effective_it_before_pue:relative_usage_proxy_v1",
      "specification_provenance": "Source-matched hardware; game throughput and memory units; power estimated from LCA usage proxy (see power_provenance).",
      "id": "20000000-0000-4000-8000-000000000003",
      "family": "cpu",
      "size": "mega",
      "cpu_cores": 32,
      "gpu_count": 0,
      "memory_gib": 64,
      "active_watts": "92.675836",
      "idle_watts": "18.535167",
      "stopped_watts": "0",
      "throughput": "32",
      "work_unit": "vcpu_hour",
      "boot_seconds": 120,
      "zones": [
        "at-vie-1",
        "at-vie-2",
        "bg-sof-1",
        "ch-dk-2",
        "ch-gva-2",
        "de-fra-1",
        "de-muc-1",
        "hr-zag-1",
        "es-mad-1",
        "it-mil-1",
        "fr-par-1"
      ]
    },
    {
      "power_basis": "it_before_pue",
      "lifecycle_kg_per_hour": "0.019195375000",
      "lifecycle_source": "exoscale-lca-estimates-v1:cpu.titan",
      "power_provenance": "estimated_effective_it_before_pue:relative_usage_proxy_v1",
      "specification_provenance": "Source-matched hardware; game throughput and memory units; power estimated from LCA usage proxy (see power_provenance).",
      "id": "20000000-0000-4000-8000-000000000004",
      "family": "cpu",
      "size": "titan",
      "cpu_cores": 40,
      "gpu_count": 0,
      "memory_gib": 128,
      "active_watts": "132.607724",
      "idle_watts": "26.521545",
      "stopped_watts": "0",
      "throughput": "40",
      "work_unit": "vcpu_hour",
      "boot_seconds": 120,
      "zones": [
        "at-vie-1",
        "at-vie-2",
        "bg-sof-1",
        "ch-dk-2",
        "ch-gva-2",
        "de-fra-1",
        "de-muc-1",
        "hr-zag-1",
        "es-mad-1",
        "it-mil-1",
        "fr-par-1"
      ]
    },
    {
      "power_basis": "it_before_pue",
      "lifecycle_kg_per_hour": "0.019059000000",
      "lifecycle_source": "exoscale-lca-estimates-v1:gpu2.small",
      "power_provenance": "estimated_effective_it_before_pue:relative_usage_proxy_v1",
      "gpu_model": "NVIDIA V100",
      "gpu_memory_gib": 16,
      "specification_provenance": "Source-matched hardware; game throughput and memory units; power estimated from LCA usage proxy (see power_provenance).",
      "id": "20000000-0000-4000-8000-000000000005",
      "family": "gpu2",
      "size": "small",
      "cpu_cores": 12,
      "gpu_count": 1,
      "memory_gib": 56,
      "active_watts": "175.370387",
      "idle_watts": "35.074077",
      "stopped_watts": "0",
      "throughput": "80",
      "work_unit": "tflop",
      "boot_seconds": 120,
      "zones": [
        "at-vie-1"
      ]
    },
    {
      "power_basis": "it_before_pue",
      "lifecycle_kg_per_hour": "0.034415000000",
      "lifecycle_source": "exoscale-lca-estimates-v1:gpu2.medium",
      "power_provenance": "estimated_effective_it_before_pue:relative_usage_proxy_v1",
      "gpu_model": "NVIDIA V100",
      "gpu_memory_gib": 16,